{
  "material_id": "web:3704326c60776c53169680099e2eed31",
  "observation_id": "obs_01J9ZQ4A0000000000000001",
  "source": {
    "source_id": "shop-example",
    "kind": "web",
    "name": "Shop Example"
  },
  "locator": {
    "url": "https://shop.example.test/product/a-100",
    "final_url": "https://shop.example.test/product/a-100",
    "canonical_url": "https://shop.example.test/product/a-100"
  },
  "fetched_at": "2026-09-27T10:00:05Z",
  "format": {
    "media_type": "text/html",
    "charset": "utf-8",
    "language": "uk",
    "content_kind": "page"
  },
  "revision": {
    "content_sha256": "e33249025b65cfa300d506c2c201202d7e96d0115ec85a33681f71370e7d4c07",
    "source_revision": "\"etag-a100-v3\""
  },
  "content": {
    "kind": "inline",
    "media_type": "text/html",
    "encoding": "utf-8",
    "data": "<html><head><title>Kettle A-100</title></head><body><h1>Kettle A-100</h1><span class=\"price\">1299.00 UAH</span><span class=\"stock\">in stock</span></body></html>",
    "size_bytes": 160,
    "sha256": "e33249025b65cfa300d506c2c201202d7e96d0115ec85a33681f71370e7d4c07"
  },
  "http": {
    "status": 200,
    "headers": {
      "content-type": "text/html; charset=utf-8",
      "etag": "\"etag-a100-v3\""
    }
  },
  "discovery": {
    "strategy": "sitemap",
    "depth": 0,
    "section": "products",
    "priority": 10
  },
  "collector": {
    "name": "web-collector",
    "version": "0.1.0",
    "rules": {
      "package_id": "shop-example.web-rules",
      "version": "1.0.0",
      "digest": "sha256:bd33d6b0fb860947abb60fbf898610d7ad28e279daf21106399995dcd911674a"
    },
    "collection_id": "job_01J9ZQ3F8W2N4K7T5B6C1D0E9F"
  },
  "metadata": {
    "title": "Kettle A-100"
  }
}
